{
  "schema": "biggz-ai.edit-authority-consent/v1",
  "contract": "biggz-ai.sdd-integration/v1",
  "operation": "sdd-attempt.grant",
  "action": "consent_required",
  "blocking": true,
  "change": "add-multi-repo-support",
  "missing_roots": [
    "C:/Users/dev/service-a",
    "C:/Users/dev/service-b"
  ],
  "headline": "This change plans work outside its authorized edit roots.",
  "reason": "the task plan targets repository roots that no edit authority covers, so apply stays blocked until a human decides.",
  "value": "Granting scopes edit authority to this change alone: the grant is recorded in the change's ledger, auditable, and dies with archive.",
  "evidence": [
    "C:/Users/dev/service-a is a Git repository root outside the authorized edit roots",
    "C:/Users/dev/service-b is a Git repository root outside the authorized edit roots"
  ],
  "choices": [
    {
      "id": "granted",
      "label": "Grant this change edit authority over the named roots",
      "effect": "This change's apply actor may edit the named repositories. The grant is per-change, audited (who, when, which roots), and dies with archive; nothing is granted to any other change.",
      "invocation": "biggz sdd-attempt grant add-multi-repo-support --expected-revision e65de71b53917f0c0b6843d8ed3ad6e81ca824de7768f9f1e68f54ff523acbb5 --root \"C:/Users/dev/service-a\" --root \"C:/Users/dev/service-b\" --actor maintainer --reason edit-authority-consent-granted --request-id grant-6bad3e38819f47a6 --change-instance sdd-fc81f251ebcaa1a347b79878d885fbce"
    },
    {
      "id": "declined",
      "label": "Keep the change blocked",
      "effect": "The change stays blocked(edit_authority_missing) and nothing is persisted. Both exits stay open: edit the change's tasks.md so no work unit targets an unauthorized root, or grant authority with the named grant invocation.",
      "invocation": "biggz sdd-status add-multi-repo-support"
    }
  ],
  "off_path_note": "To keep this change single-repository instead, edit its tasks.md so no work unit targets an unauthorized root, then re-enter through 'biggz sdd-status add-multi-repo-support'.",
  "off_path_command": "biggz sdd-status add-multi-repo-support"
}
